{
  "schema_version": 1,
  "consideration_id": "consideration:0ca76343-466a-45ae-b9f1-7fc3fe952ddd",
  "character_id": "character:beaky",
  "trace": {
    "traceparent": "00-4bf92f3577b34da6a3ce929d0e0e4736-7a9c2f8e6b31d402-01",
    "tracestate": null,
    "baggage": null
  },
  "event": {
    "event_id": "6c229b8f-f23e-4571-bdd4-875bb4ec9e2c",
    "type": "schedule.departure_attention"
  },
  "world_facts": [
    {
      "statement": "Church begins in 30 minutes",
      "confidence": 1.0,
      "fact_id": "fact:107ee4ab-c514-403a-aec8-55ee8dd2972c"
    },
    {
      "statement": "April is probably in the workshop",
      "confidence": 0.87,
      "fact_id": "fact:85e34704-c888-4e81-b38b-5d6b70b32733"
    }
  ],
  "relevant_memories": [
    {
      "memory_id": "memory:20e23bee-3ac7-458c-a61f-c2f867662132",
      "summary": "I reminded April about church last Sunday."
    }
  ],
  "known_participants": ["person:april"],
  "prior_reaction_interaction_ids": []
}
